ajs-macbookpro:~ ajs$ nc router 5000
tcpdump: verbose output suppressed, use -v or -vv for full protocol decode
listening on br0, link-type EN10MB (Ethernet), capture size 65535 bytes
16:17:47.598691 IP ajs-macbookpro.49787 > router.domain: 38098+ A? ssl.gstatic.com. (33)
16:17:47.611243 IP router.domain > ajs-macbookpro.49787: 38098 4/0/0 A 173.194.33.127, A 173.194.33.111, A 173.194.33.119, A 173.194.33.120 (97)
16:17:58.960680 IP ajs-macbookpro.62628 > router.domain: 41800+ A? foo.asdfsdf.com. (33)
16:17:59.233480 IP router.domain > ajs-macbookpro.62628: 41800 1/0/0 A 54.209.129.218 (49)
16:17:59.397228 IP ajs-macbookpro.56069 > router.domain: 60300+ AAAA? foo.asdfsdf.com. (33)
16:17:59.511361 IP router.domain > ajs-macbookpro.56069: 60300 0/0/0 (33)
16:17:59.512742 IP ajs-macbookpro.64468 > router.domain: 58155+ MX? foo.asdfsdf.com. (33)
16:17:59.660573 IP router.domain > ajs-macbookpro.64468: 58155 0/0/0 (33)
16:18:04.956456 IP ajs-macbookpro.54483 > router.domain: 44484+ A? foo.asdfsdf.com2. (34)
16:18:04.994370 IP router.domain > ajs-macbookpro.54483: 44484 NXDomain 0/1/0 (109)
16:18:04.997392 IP ajs-macbookpro.64336 > router.domain: 61065+ A? foo.asdfsdf.com2. (34)
16:18:04.997882 IP router.domain > ajs-macbookpro.64336: 61065 NXDomain 0/0/0 (34)
16:18:06.102865 IP ajs-macbookpro.63998 > router.domain: 14918+ A? foo.asdfsdf.com3. (34)
16:18:06.177655 IP router.domain > ajs-macbookpro.63998: 14918 NXDomain 0/1/0 (109)
16:18:06.179072 IP ajs-macbookpro.62510 > router.domain: 49420+ A? foo.asdfsdf.com3. (34)
16:18:06.179612 IP router.domain > ajs-macbookpro.62510: 49420 NXDomain 0/0/0 (34)
16:18:07.086799 IP ajs-macbookpro.63506 > router.domain: 53460+ A? foo.asdfsdf.com4. (34)
16:18:07.125331 IP router.domain > ajs-macbookpro.63506: 53460 NXDomain 0/1/0 (109)
16:18:07.129440 IP ajs-macbookpro.63907 > router.domain: 47341+ A? foo.asdfsdf.com4. (34)
16:18:07.129877 IP router.domain > ajs-macbookpro.63907: 47341 NXDomain 0/0/0 (34)
16:18:08.078619 IP ajs-macbookpro.53110 > router.domain: 58984+ A? foo.asdfsdf.com5. (34)
16:18:08.119639 IP router.domain > ajs-macbookpro.53110: 58984 NXDomain 0/1/0 (109)
16:18:08.120882 IP ajs-macbookpro.63065 > router.domain: 45084+ A? foo.asdfsdf.com5. (34)
16:18:08.121324 IP router.domain > ajs-macbookpro.63065: 45084 NXDomain 0/0/0 (34)
16:18:10.059200 IP ajs-macbookpro.62585 > router.domain: 59166+ A? foo.asdfsdf.com6. (34)
16:18:10.168819 IP router.domain > ajs-macbookpro.62585: 59166 NXDomain 0/1/0 (109)
16:18:10.170185 IP ajs-macbookpro.60616 > router.domain: 59352+ A? foo.asdfsdf.com6. (34)
16:18:10.170592 IP router.domain > ajs-macbookpro.60616: 59352 NXDomain 0/0/0 (34)
16:18:11.806562 IP ajs-macbookpro.61594 > router.domain: 14490+ A? foo.asdfsdf.com7. (34)
16:18:11.876890 IP router.domain > ajs-macbookpro.61594: 14490 NXDomain 0/1/0 (109)
16:18:11.878664 IP ajs-macbookpro.57042 > router.domain: 40003+ A? foo.asdfsdf.com7. (34)
16:18:11.879227 IP router.domain > ajs-macbookpro.57042: 40003 NXDomain 0/0/0 (34)
16:18:25.308104 IP ajs-macbookpro.42420 > router.domain: 60242+ A? www.googleapis.com. (36)
16:18:25.318372 IP router.domain > ajs-macbookpro.42420: 60242 2/0/0 CNAME googleapis.l.google.com., A 74.125.28.95 (86)
16:18:25.340026 IP ajs-macbookpro.60492 > router.domain: 18456+ A? www.google-analytics.com. (42)
16:18:25.352663 IP router.domain > ajs-macbookpro.60492: 18456 12/0/0 CNAME www-google-analytics.l.google.com., A 173.194.33.0, A 173.194.33.7, A 173.194.33.1, A 173.194.33.5, A 173.194.33.6, A 173.194.33.8, A 173.194.33.4, A 173.194.33.9, A 173.194.33.14, A 173.194.33.3, A 173.194.33.2 (262)
16:18:25.546579 IP ajs-macbookpro.32741 > router.domain: 64020+ A? play.google.com. (33)
16:18:25.558456 IP router.domain > ajs-macbookpro.32741: 64020 12/0/0 CNAME www3.l.google.com., A 173.194.33.160, A 173.194.33.166, A 173.194.33.163, A 173.194.33.168, A 173.194.33.169, A 173.194.33.165, A 173.194.33.174, A 173.194.33.167, A 173.194.33.164, A 173.194.33.161, A 173.194.33.162 (230)
16:18:41.537933 IP ajs-macbookpro.35909 > router.domain: 41522+ A? login.corp.google.com. (39)
16:18:41.539113 IP ajs-macbookpro.14696 > router.domain: 1708+ A? www.google.com. (32)
16:18:41.539212 IP ajs-macbookpro.1518 > router.domain: 10689+ A? spdy-proxy.ext.google.com. (43)
16:18:41.539265 IP ajs-macbookpro.4700 > router.domain: 15127+ A? clients5.google.com. (37)
16:18:41.539316 IP ajs-macbookpro.49609 > router.domain: 12260+ A? id.google.com. (31)
16:18:41.539366 IP ajs-macbookpro.31668 > router.domain: 34445+ A? lh6.googleusercontent.com. (43)
16:18:41.556452 IP router.domain > ajs-macbookpro.14696: 1708 5/0/0 A 173.194.33.16, A 173.194.33.18, A 173.194.33.17, A 173.194.33.20, A 173.194.33.19 (112)
16:18:41.557546 IP router.domain > ajs-macbookpro.31668: 34445 4/0/0 CNAME googlehosted.l.googleusercontent.com., A 173.194.33.171, A 173.194.33.172, A 173.194.33.170 (120)
16:18:41.558042 IP router.domain > ajs-macbookpro.4700: 15127 12/0/0 CNAME clients.l.google.com., A 173.194.33.164, A 173.194.33.168, A 173.194.33.160, A 173.194.33.161, A 173.194.33.167, A 173.194.33.174, A 173.194.33.166, A 173.194.33.169, A 173.194.33.165, A 173.194.33.162, A 173.194.33.163 (237)
16:18:41.564153 IP router.domain > ajs-macbookpro.49609: 12260 5/0/0 CNAME id.l.google.com., A 173.194.33.159, A 173.194.33.151, A 173.194.33.143, A 173.194.33.152 (114)
16:18:41.565106 IP router.domain > ajs-macbookpro.1518: 10689 2/0/0 CNAME corp-spdy-proxy.l.google.com., A 216.239.45.146 (91)
16:18:41.565814 IP ajs-macbookpro.62830 > router.domain: 56486+ A? plus.sandbox.google.com. (41)
16:18:41.566115 IP ajs-macbookpro.43090 > router.domain: 57323+ A? s2.googleusercontent.com. (42)
16:18:41.566313 IP ajs-macbookpro.44190 > router.domain: 47779+ A? www.gstatic.com. (33)
16:18:41.567864 IP router.domain > ajs-macbookpro.44190: 47779 4/0/0 A 173.194.33.184, A 173.194.33.175, A 173.194.33.183, A 173.194.33.191 (97)
16:18:41.585489 IP router.domain > ajs-macbookpro.43090: 57323 4/0/0 CNAME googlehosted.l.googleusercontent.com., A 173.194.33.172, A 173.194.33.171, A 173.194.33.170 (119)
16:18:41.600584 IP router.domain > ajs-macbookpro.35909: 41522 2/0/0 CNAME uberproxy.l.google.com., A 74.125.20.129 (81)
16:18:41.631402 IP router.domain > ajs-macbookpro.62830: 56486 2/0/0 CNAME sandbox.l.google.com., A 74.125.20.81 (81)
16:18:47.668990 IP ajs-macbookpro.40560 > router.domain: 34653+ A? apis.google.com. (33)
16:18:47.705686 IP router.domain > ajs-macbookpro.40560: 34653 12/0/0 CNAME plus.l.google.com., A 173.194.33.78, A 173.194.33.71, A 173.194.33.70, A 173.194.33.67, A 173.194.33.66, A 173.194.33.65, A 173.194.33.73, A 173.194.33.72, A 173.194.33.69, A 173.194.33.64, A 173.194.33.68 (230)
16:19:20.649347 IP roku3.44177 > router.domain: 19629+ A? nrdp.nccp.netflix.com. (39)
16:19:20.650015 IP roku3.41840 > google-public-dns-a.google.com.domain: 46079+ A? nrdp.nccp.netflix.com. (39)
16:19:20.662831 IP router.domain > roku3.44177: 19629 3/0/0 CNAME nrdp.nccp.us-west-2.netflix.com., CNAME nrdp.nccp.us-west-2.prodaa.netflix.com., A 54.245.91.128 (130)
16:19:20.669922 IP google-public-dns-a.google.com.domain > roku3.41840: 46079 3/0/0 CNAME nrdp.nccp.us-west-2.netflix.com., CNAME nrdp.nccp.us-west-2.prodaa.netflix.com., A 54.244.243.204 (130)
16:19:20.913311 IP roku3.44177 > router.domain: 33655+ A? ichnaea.netflix.com. (37)
16:19:20.913361 IP roku3.41840 > google-public-dns-a.google.com.domain: 14148+ A? ichnaea.netflix.com. (37)
16:19:20.935346 IP google-public-dns-a.google.com.domain > roku3.41840: 14148 10/0/0 CNAME ichnaea.us-west-2.netflix.com., CNAME ichnaea.us-west-2.prodaa.netflix.com., A 54.245.239.184, A 54.244.234.42, A 54.214.26.188, A 50.112.100.250, A 50.112.106.255, A 54.244.238.4, A 54.244.223.44, A 54.245.242.144 (236)
16:19:20.954265 IP router.domain > roku3.44177: 33655 10/0/0 CNAME ichnaea.us-east-1.netflix.com., CNAME ichnaea.us-east-1.prodaa.netflix.com., A 184.73.249.177, A 50.17.207.84, A 23.21.234.206, A 23.21.137.97, A 50.16.200.233, A 23.23.166.13, A 23.21.83.254, A 23.21.251.225 (236)
16:19:42.112493 IP roku3.44177 > router.domain: 57699+ A? nrdp.nccp.netflix.com. (39)
16:19:42.113028 IP roku3.41840 > google-public-dns-a.google.com.domain: 19885+ A? nrdp.nccp.netflix.com. (39)
